{
  "$schema": "./schema/release-manifest.v1.schema.json",
  "schemaVersion": "1.0.0",
  "manifestVersion": 1,
  "channel": "stable",
  "publishedAt": "2026-03-07T05:44:00Z",
  "release": {
    "id": "2026.03.07-stable.1",
    "notesUrl": "https://github.com/agencymatthewg-beep/opta/releases/tag/opta-daemon-v0.4.1",
    "minManagerVersion": "0.6.0"
  },
  "rollout": {
    "strategy": "immediate",
    "percentage": 100,
    "cohort": "all",
    "startsAt": "2026-03-02T02:30:00Z",
    "allowDowngrade": false
  },
  "components": [
    {
      "id": "opta-cli",
      "displayName": "Opta CLI",
      "version": "0.5.0-alpha.15",
      "minManagerVersion": "0.6.0",
      "track": "stable",
      "rollout": {
        "percentage": 100,
        "priority": 1
      },
      "artifacts": {
        "macos": [
          {
            "platform": "macos",
            "arch": "universal",
            "packageType": "tar.gz",
            "url": "https://github.com/agencymatthewg-beep/opta/releases/download/v0.5.0-alpha.15/opta-cli-npm.tgz"
          }
        ],
        "windows": [
          {
            "platform": "windows",
            "arch": "x64",
            "packageType": "tar.gz",
            "url": "https://github.com/agencymatthewg-beep/opta/releases/download/v0.5.0-alpha.15/opta-cli-npm.tgz"
          }
        ]
      }
    },
    {
      "id": "opta-lmx",
      "displayName": "Opta LMX Runtime",
      "version": "0.6.2",
      "minManagerVersion": "0.6.0",
      "track": "stable",
      "rollout": {
        "percentage": 0,
        "priority": 2
      },
      "artifacts": {
        "macos": [],
        "windows": []
      }
    },
    {
      "id": "opta-code-universal",
      "displayName": "Opta Code Desktop",
      "version": "0.2.2",
      "minManagerVersion": "0.6.0",
      "track": "stable",
      "rollout": {
        "percentage": 0,
        "priority": 3
      },
      "artifacts": {
        "macos": [],
        "windows": []
      }
    },
    {
      "id": "opta-daemon",
      "displayName": "Opta Daemon Service",
      "version": "0.4.1",
      "minManagerVersion": "0.6.0",
      "track": "stable",
      "rollout": {
        "percentage": 5,
        "priority": 4
      },
      "artifacts": {
        "macos": [
          {
            "platform": "macos",
            "arch": "universal",
            "packageType": "tar.gz",
            "url": "https://github.com/agencymatthewg-beep/opta/releases/download/opta-daemon-v0.4.1/opta-daemon-macos-universal.tar.gz"
          }
        ],
        "windows": [
          {
            "platform": "windows",
            "arch": "x64",
            "packageType": "zip",
            "url": "https://github.com/agencymatthewg-beep/opta/releases/download/opta-daemon-v0.4.1/opta-daemon-windows-x64.zip"
          }
        ]
      }
    }
  ]
}
